{
  "schema": "agent-memory-staging-alert-routing-input-v1",
  "classification": "staging_external",
  "environment": "staging",
  "bundle_id": "alert-bundle-2026-08-10",
  "rule_set_version": "rules-v1",
  "route_version": "routes-v1",
  "roster_version": "roster-v1",
  "target_version": "targets-v1",
  "inventory_id": "staging-inventory",
  "inventory_receipt_sha256": "aaaaaaaaaaaaaaaaaaaaaaaaaaaaaaaaaaaaaaaaaaaaaaaaaaaaaaaaaaaaaaaa",
  "plan_id": "staging-plan",
  "plan_receipt_sha256": "bbbbbbbbbbbbbbbbbbbbbbbbbbbbbbbbbbbbbbbbbbbbbbbbbbbbbbbbbbbbbbbb",
  "change_id": "staging-change",
  "change_receipt_sha256": "cccccccccccccccccccccccccccccccccccccccccccccccccccccccccccccccc",
  "release_id": "staging-release",
  "release_receipt_sha256": "dddddddddddddddddddddddddddddddddddddddddddddddddddddddddddddddd",
  "rule_export_sha256": "1111111111111111111111111111111111111111111111111111111111111111",
  "route_export_sha256": "2222222222222222222222222222222222222222222222222222222222222222",
  "owner_roster_sha256": "3333333333333333333333333333333333333333333333333333333333333333",
  "synthetic_report_sha256": "4444444444444444444444444444444444444444444444444444444444444444",
  "target_decision_sha256": "5555555555555555555555555555555555555555555555555555555555555555",
  "started_at": "2026-08-10T12:00:00Z",
  "completed_at": "2026-08-10T16:00:00Z",
  "generated_at": "2026-08-10T17:30:00Z",
  "ready": true,
  "alerts": [
    {"id": "api_error_budget_burn", "severity": "page", "owner_slot_version": "operations-primary-v1", "triggered_at": "2026-08-10T12:00:00Z", "delivered_at": "2026-08-10T12:00:30Z", "escalated_at": "2026-08-10T12:02:00Z", "acknowledged_at": "2026-08-10T12:03:00Z", "resolved_at": "2026-08-10T12:05:00Z", "maximum_delivery_seconds": 60, "maximum_acknowledgement_seconds": 300, "outcome": "passed", "evidence_sha256": "6666666666666666666666666666666666666666666666666666666666666666"},
    {"id": "api_latency_high", "severity": "ticket", "owner_slot_version": "operations-secondary-v1", "triggered_at": "2026-08-10T12:30:00Z", "delivered_at": "2026-08-10T12:30:30Z", "escalated_at": "2026-08-10T12:32:00Z", "acknowledged_at": "2026-08-10T12:33:00Z", "resolved_at": "2026-08-10T12:35:00Z", "maximum_delivery_seconds": 60, "maximum_acknowledgement_seconds": 300, "outcome": "passed", "evidence_sha256": "7777777777777777777777777777777777777777777777777777777777777777"},
    {"id": "worker_failures", "severity": "page", "owner_slot_version": "operations-primary-v1", "triggered_at": "2026-08-10T13:00:00Z", "delivered_at": "2026-08-10T13:00:30Z", "escalated_at": "2026-08-10T13:02:00Z", "acknowledged_at": "2026-08-10T13:03:00Z", "resolved_at": "2026-08-10T13:05:00Z", "maximum_delivery_seconds": 60, "maximum_acknowledgement_seconds": 300, "outcome": "passed", "evidence_sha256": "8888888888888888888888888888888888888888888888888888888888888888"},
    {"id": "queue_failures", "severity": "page", "owner_slot_version": "operations-primary-v1", "triggered_at": "2026-08-10T13:30:00Z", "delivered_at": "2026-08-10T13:30:30Z", "escalated_at": "2026-08-10T13:32:00Z", "acknowledged_at": "2026-08-10T13:33:00Z", "resolved_at": "2026-08-10T13:35:00Z", "maximum_delivery_seconds": 60, "maximum_acknowledgement_seconds": 300, "outcome": "passed", "evidence_sha256": "9999999999999999999999999999999999999999999999999999999999999999"},
    {"id": "object_storage_failures", "severity": "page", "owner_slot_version": "operations-primary-v1", "triggered_at": "2026-08-10T14:00:00Z", "delivered_at": "2026-08-10T14:00:30Z", "escalated_at": "2026-08-10T14:02:00Z", "acknowledged_at": "2026-08-10T14:03:00Z", "resolved_at": "2026-08-10T14:05:00Z", "maximum_delivery_seconds": 60, "maximum_acknowledgement_seconds": 300, "outcome": "passed", "evidence_sha256": "aaaaaaaaaaaaaaaaaaaaaaaaaaaaaaaaaaaaaaaaaaaaaaaaaaaaaaaaaaaaaaaa"},
    {"id": "model_gateway_failures", "severity": "ticket", "owner_slot_version": "operations-secondary-v1", "triggered_at": "2026-08-10T14:30:00Z", "delivered_at": "2026-08-10T14:30:30Z", "escalated_at": "2026-08-10T14:32:00Z", "acknowledged_at": "2026-08-10T14:33:00Z", "resolved_at": "2026-08-10T14:35:00Z", "maximum_delivery_seconds": 60, "maximum_acknowledgement_seconds": 300, "outcome": "passed", "evidence_sha256": "bbbbbbbbbbbbbbbbbbbbbbbbbbbbbbbbbbbbbbbbbbbbbbbbbbbbbbbbbbbbbbbb"},
    {"id": "cost_spike", "severity": "ticket", "owner_slot_version": "finance-operations-v1", "triggered_at": "2026-08-10T15:00:00Z", "delivered_at": "2026-08-10T15:00:30Z", "escalated_at": "2026-08-10T15:02:00Z", "acknowledged_at": "2026-08-10T15:03:00Z", "resolved_at": "2026-08-10T15:05:00Z", "maximum_delivery_seconds": 60, "maximum_acknowledgement_seconds": 300, "outcome": "passed", "evidence_sha256": "cccccccccccccccccccccccccccccccccccccccccccccccccccccccccccccccc"}
  ]
}
